{"$schema":"https://json-schema.org/draft/2020-12/schema","$id":"https://grandchallenge.ai/schemas/openai_ten_proofs_permanent_route_proposal_registry.schema.json","title":"OpenAI Ten Proofs Permanent Route Proposal Registry","type":"object","additionalProperties":false,"required":["schema_version","record_type","registry_id","candidate_id","tracker_issue","authority","proposal","state","scope","route_controls","activation","candidate_disposition","claim_boundary"],"properties":{"schema_version":{"const":"1.0.0"},"record_type":{"const":"openai_ten_proofs_permanent_route_proposal_registry"},"registry_id":{"const":"MC-OTP-C-PERMANENT-ROUTE-PROPOSAL-001"},"candidate_id":{"const":"OPENAI-TEN-PROOFS-001"},"tracker_issue":{"const":"https://github.com/grandchallenge/MATHCERT/issues/99"},"authority":{"type":"object","additionalProperties":false,"required":["cert_replay_evidence_merge","cert_replay_evidence_record_blob","global_registered_route_registry_blob"],"properties":{"cert_replay_evidence_merge":{"$ref":"#/$defs/sha40"},"cert_replay_evidence_record_blob":{"$ref":"#/$defs/sha40"},"global_registered_route_registry_blob":{"$ref":"#/$defs/sha40"}}},"proposal":{"type":"object","additionalProperties":false,"required":["result_family","proposal_id","requested_route_id","path","digest_algorithm","digest"],"properties":{"result_family":{"const":"OTP-C-PERMANENT"},"proposal_id":{"const":"MC-OTP-ROUTE-PROPOSAL-C-PERMANENT-FORMULA"},"requested_route_id":{"const":"MC-ROUTE-OTP-C-PERMANENT-FORMULA"},"path":{"const":"governance/result_family_route_proposal_successors/OTP-C-PERMANENT.json"},"digest_algorithm":{"const":"git_blob_sha1"},"digest":{"$ref":"#/$defs/sha40"}}},"state":{"type":"object","additionalProperties":false,"required":["proposal_count","registered_route_count_created_by_this_operation","adjudication_count","cert_output_count","mathematical_target_proved_count","aggregate_route_count"],"properties":{"proposal_count":{"const":1},"registered_route_count_created_by_this_operation":{"const":0},"adjudication_count":{"const":0},"cert_output_count":{"const":0},"mathematical_target_proved_count":{"const":0},"aggregate_route_count":{"const":0}}},"scope":{"type":"object","additionalProperties":false,"required":["formula_target_count","circuit_target_count","gate_bounds_in_route","total_leaves_vertices_in_route","historical_pdf_byte_equivalence"],"properties":{"formula_target_count":{"const":2},"circuit_target_count":{"const":0},"gate_bounds_in_route":{"const":false},"total_leaves_vertices_in_route":{"const":false},"historical_pdf_byte_equivalence":{"const":false}}},"route_controls":{"type":"object","additionalProperties":false,"required":["global_registered_route_registry_modified","proposal_registry_separate","may_register_route","may_adjudicate","may_issue_cert_output","may_mark_target_proved","aggregate_route_prohibited","may_promote_claim"],"properties":{"global_registered_route_registry_modified":{"const":false},"proposal_registry_separate":{"const":true},"may_register_route":{"const":false},"may_adjudicate":{"const":false},"may_issue_cert_output":{"const":false},"may_mark_target_proved":{"const":false},"aggregate_route_prohibited":{"const":true},"may_promote_claim":{"const":false}}},"activation":{"type":"object","additionalProperties":false,"required":["condition","head_change_requires_reapproval","effect"],"properties":{"condition":{"type":"string","minLength":40},"head_change_requires_reapproval":{"const":true},"effect":{"const":"one_permanent_formula_route_proposal_admitted_no_registration_no_adjudication"}}},"candidate_disposition":{"const":"PERMANENT_FORMULA_CERT_ROUTE_PROPOSAL_CLEAR__REGISTRATION_NOT_YET_AUTHORIZED"},"claim_boundary":{"type":"string","minLength":250}},"$defs":{"sha40":{"type":"string","pattern":"^[0-9a-f]{40}$"}}}
